{
  "asset": {
    "asset_id": "CNC-S01-L01-01",
    "asset_type": "cnc",
    "display_name": "CNC S01-L01-01",
    "site_id": "S01",
    "cell_id": "L01",
    "observed_at": "2026-08-01T00:00:00+09:00"
  },
  "risk": {
    "current": 0.41,
    "threshold": 0.65,
    "status_grade": "attention",
    "prediction_horizon_hours": 24
  },
  "risk_series": [
    {
      "observed_at": "2026-07-31T21:00:00+09:00",
      "failure_probability": 0.33,
      "status_grade": "attention",
      "prediction_id": "CNC-S01-L01-01#2026-07-31T21:00:00+09:00",
      "source_kind": "runtime_inference",
      "source_ref": "prediction-results://prediction_results/CNC-S01-L01-01/2026-07-31T21:00:00+09:00"
    },
    {
      "observed_at": "2026-08-01T00:00:00+09:00",
      "failure_probability": 0.41,
      "status_grade": "attention",
      "prediction_id": "CNC-S01-L01-01#2026-08-01T00:00:00+09:00",
      "source_kind": "runtime_inference",
      "source_ref": "prediction-results://prediction_results/CNC-S01-L01-01/2026-08-01T00:00:00+09:00"
    }
  ],
  "features": [
    {
      "key": "torque_nm",
      "label": "토크",
      "unit": "N·m",
      "current": 46.8,
      "baseline": {
        "mean": 40.2,
        "std": 3.1,
        "lower": 34.0,
        "upper": 46.4,
        "reference": "all_valid_rows canonical-ai4i-physics-v3.1 cnc_sensor_observation.csv"
      },
      "series": [
        {
          "observed_at": "2026-07-31T21:00:00+09:00",
          "value": 43.5,
          "quality_status": "good",
          "source_ref": "observation://CNC-S01-L01-01.torque_nm/2026-07-31T21:00:00+09:00"
        },
        {
          "observed_at": "2026-08-01T00:00:00+09:00",
          "value": 46.8,
          "quality_status": "good",
          "source_ref": "observation://CNC-S01-L01-01.torque_nm/2026-08-01T00:00:00+09:00"
        }
      ],
      "top_factor": {
        "rank": 1,
        "contribution": 0.27,
        "direction": "risk_up",
        "explanation_method": "model_artifact_local_proxy_attribution",
        "evidence_field_id": "factor.1.torque_nm"
      }
    },
    {
      "key": "tool_wear_min",
      "label": "공구 마모",
      "unit": "분",
      "current": 128.0,
      "baseline": null,
      "series": [
        {
          "observed_at": "2026-07-31T21:00:00+09:00",
          "value": 121.0,
          "quality_status": "good",
          "source_ref": "observation://CNC-S01-L01-01.tool_wear_min/2026-07-31T21:00:00+09:00"
        },
        {
          "observed_at": "2026-08-01T00:00:00+09:00",
          "value": 128.0,
          "quality_status": "good",
          "source_ref": "observation://CNC-S01-L01-01.tool_wear_min/2026-08-01T00:00:00+09:00"
        }
      ],
      "top_factor": null
    }
  ],
  "equipment_history": [
    {
      "occurred_at": "2026-07-20T09:00:00+09:00",
      "kind": "maintenance_note",
      "tone": "normal",
      "description": "정기 공구 교체",
      "source": "activity"
    }
  ],
  "evidence": {
    "artifact_id": "RESULT#CNC-S01-L01-01#2026-08-01T00:00:00+09:00",
    "evidence_payload_reference": "producer-enriched-attention",
    "model_version": "canonical-ai4i-physics-v3.1",
    "dataset_version": "canonical-ai4i-physics-v3.1",
    "source_kind": "runtime_inference",
    "gaps": [
      {
        "field": "features[1].baseline",
        "reason": "evidence_payload.sensor_evidence.sensors.tool_wear_min has no basis (baseline window rows unavailable for this feature); current value and series are still shown",
        "owner_domain": "diagnosis"
      }
    ]
  },
  "data_status": {
    "source": "canonical",
    "is_stale": false,
    "is_data_quality_hold": false,
    "last_updated_at": "2026-08-01T00:00:00+09:00",
    "warnings": [
      "features[1].baseline unavailable; range-crossing markers must not be computed for tool_wear_min"
    ]
  }
}
